judul,provinsi,id_teks,teks,referensi
Mentiko Betuah,Aceh,36,"malam sudah larut, dan kucing mengetahui bahwa orang itu telah tidur nyenyak. tanpa membuang waktu, mereka mulai bekerja, dan akhirnya rencana itu berhasil. mentiko betuah itu mereka larikan. tetapi, setiba di pinggir sungai yang mereka lalui tadi, ternyata air sungainya mengalir sangat deras sehingga menyusahkan mereka untuk menyeberanginya. timbul pula kesukaran tentang siapa di antara mereka yang akan memegang mentiko betuah itu agar tidak jatuh ke dalam sungai. bila anjing yang akan memegangnya dengan mulut ketika berenang, dikhawatirkan bila ia lelah, mulutnya akan terbuka, dan benda itu akan jatuh ke dalam air. demikian pula dengan kucing dan tikus, mereka takut benda itu jatuh ke sungai.","bengi wis suwe, lan kucing ngerti yen wong kuwi wis turu nyenyak. tanpa ngentekake wektu, padha miwiti nyambut gawe, lan akhire rencanane kasil. mentiko betuah kuwi padha nggawa mlayu. nanging, sak tekane ing pinggir kali sing dilalui mau, jebul banyu kali kuwi mili deras banget nganti nyusahke kanggo nyebrang. muncul maneh kesusahan bab sapa sing bakal nyekel mentiko betuah kuwi supaya ora tiba ing kali. yen asu sing bakal nyekel nganggo cangkeme nalika nglangi, kuwatir yen kesel, cangkeme bakal mbukak, lan barang kuwi bakal tiba ing banyu. mangkono uga karo kucing lan tikus, padha wedi barang kuwi tiba ing kali."
Mentiko Betuah,Aceh,37,"akhirnya, anjing berkata, kalau begitu, sayalah yang membawanya.","akhire, asu ngomong, yen ngono, aku wae sing nggawa."
Mentiko Betuah,Aceh,38,"lalu mereka pun mulai berenang menyeberangi sungai yang deras itu. dalam penyeberangan tersebut, benda yang mereka bawa dipegang oleh kucing. ketika sampai di tengah-tengah sungai, mentiko betuah itu jatuh dari tangan kucing. lalu tikus menyambut benda itu dan memasukkannya ke dalam mulutnya. hal tersebut rupanya tidak diketahui oleh kucing dan anjing.","banjur padha miwiti nyebrang kali sing deras kuwi. ing panyebrangan kuwi, barang sing digawa kuwi dicekel karo kucing. nalika tekan tengah kali, mentiko betuah kuwi tiba saka tangane kucing. banjur tikus nyekel barang kuwi lan dilebokake ing cangkeme. kuwi ora dingerteni karo kucing lan asu."
Mentiko Betuah,Aceh,39,"setiba mereka di darat, mereka pun berunding lagi untuk mencari jalan agar mentiko betuah yang dikira jatuh ke dalam sungai dapat diambil kembali. anjing dan kucing lalu menyelam, tetapi apa yang mereka cari tak kunjung ditemukan. sebenarnya, tikus telah menipu mereka. setibanya di rumah, anak raja masih tidur. mereka menunggu sampai subuh. rupanya, tikus penipu tadi, ketika anjing dan kucing belum datang, sudah lebih dulu menghadap anak raja dan menyerahkan mentiko betuah itu kepadanya.","sawise tekan dharatan, banjur padha rembugan maneh kanggo golek cara supaya mentiko betuah sing dikira tiba ing kali bisa dijupuk maneh. asu lan kucing banjur nyilem, nanging barang sing digoleki ora tinemu-tinemu. sak tenane, tikus wis nipu wong loro kuwi. sawise tekan omah, anak raja isih turu. padha ngenteni nganti subuh. jebule, tikus penipu kuwi, nalika asu lan kucing durung teka, wis luwih dhisik ngadhep anak raja lan nyerahke mentiko betuah kuwi marang dheweke."
Mentiko Betuah,Aceh,40,"anak raja sangat gembira, tetapi kucing dan anjing menangis tersedu-sedu. kemudian mereka ditanyai oleh anak raja, mengapa engkau menangis bukankah mentiko betuah itu sudah dapat","anak raja bungah banget, nanging kucing lan asu nangis sesenggukan. banjur ditakoni karo anak raja, ngapa kowe nangis apa ora mentiko betuah kuwi wis isa diduweni"
Mentiko Betuah,Aceh,41,"mendengar ucapan anak raja, kucing dan anjing saling berpandangan, dan mereka mengerti bahwa mereka telah ditipu oleh tikus. bukan main marahnya kucing dan anjing kepada tikus karena telah menipunya. mereka mencaci-maki tikus itu dengan kemarahan yang amat sangat sehingga kumis kucing berdiri dan matanya merah menyala. lalu katanya, tunggu bagianmu, hai tikus jahanam. engkau akan kumakan, dan aku dendam dari dunia sampai akhirat.","krungu omongan anak raja, kucing lan asu padha mandang-pandangan, lan padha ngerti yen wis ditipu karo tikus. ora main nesune kucing lan asu marang tikus awit wis nipu. padha misuh-misuh marang tikus kuwi nganggo nesu banget nganti kumise kucing ngadeg lan matane abang murub. banjur ngomonge, enten bageanmu, he tikus jahanam. kowe bakal tak pangan, lan aku dendam saka donya nganti akhirat."
Mentiko Betuah,Aceh,42,"kutukan serupa itu terhadap tikus juga diucapkan oleh anjing. akhirnya, mereka menyembah dan bersujud di hadapan anak raja. kepada mereka disajikan makanan yang lezat-lezat. setelah selesai makan, mereka pulang. tetapi, sejak saat itu, kucing dan anjing mulai mengejar tikus dengan segenap tenaganya.","kutukan kaya mangkono marang tikus uga diucapkake karo asu. akhire, padha sembah lan sujud ing ngarepe anak raja. marang wong-wong kuwi disuguhake panganan sing enak-enak. sawise rampung mangan, padha mulih. nanging, wiwit wektu kuwi, kucing lan asu miwiti ngoyak tikus nganggo sakabehe tenaga."
Mentiko Betuah,Aceh,43,"justru karena itulah, hingga sekarang, kucing dan anjing sangat bermusuhan dengan tikus.","mula saka kuwi, nganti saiki, kucing lan asu banget musuhan karo tikus."
