judul,provinsi,id_teks,teks,referensi
Mentiko Betuah,Aceh,1,"pada suatu negeri, ada seorang raja yang amat kaya. raja itu sangat disenangi oleh rakyatnya. tetapi, sayang, raja tersebut tidak mempunyai anak walaupun sudah sepuluh tahun membina rumah tangga. pada suatu malam, ia berbincang-bincang dengan istrinya. percakapan mereka tidak lain adalah mengenai nasib mereka yang sudah lama belum mempunyai anak. lalu raja tersebut berkata kepada istrinya, adinda, bagaimana gerangan nasib kita ini walaupun kakanda adalah seorang raja yang amat kaya di negeri ini, tetapi kepada siapakah kekayaan itu akan kita wariskan dan bagaimana pikiran adinda mengenai hal itu","ing sawijining negari, ana sawijining raja sing sugih banget. raja kuwi banget disenengi karo rakyate. nanging, sayange, raja kuwi ora nduweni anak sanajan wis sepuluh taun mbangun rumah tangga. ing sawijining bengi, dheweke padha rembugan karo bojone. rembugane ora liya yaiku bab nasibe sing wis suwe durung nduweni anak. banjur raja kuwi ngomong marang bojone, adinda, piye kira-kira nasibe awake dhewe iki sanajan kakanda iku sawijining raja sing banget sugih ing negari iki, nanging marang sapa bandha kuwi bakal kita warisake lan piye pamikirane adinda bab kuwi"
Mentiko Betuah,Aceh,2,"pada saya ada satu cara, jawab istrinya.","ing aku ana siji cara, wangsulane bojone."
Mentiko Betuah,Aceh,3,"jalan apakah itu, adinda tanyanya mendesak istrinya itu.","dalane apa kuwi, adinda takone nyedak bojone kuwi."
Mentiko Betuah,Aceh,4,"kemudian istrinya itu mengatakan, kita pergi ke hulu sebuah sungai yang airnya sangat dingin. di sana kita ber-iimau dan bernazar kepada tuhan yang maha esa agar kepada kita diberkahi seorang anak.","banjur bojone kuwi ngomong, awake dhewe lunga menyang hulu sawijining kali sing banyune adhem banget. ing kono awake dhewe padha adus lan nadzar marang gusti allah kang maha kuwasa supaya awake dhewe diparingi anak."
Mentiko Betuah,Aceh,5,"setelah mendengar ucapan istrinya itu, maka keesokan harinya, dengan persiapan dan perlengkapan yang cukup, berangkatlah raja beserta istrinya ke tempat tersebut. tempat yang dituju itu memang sangat jauh, menempuh hutan belantara, naik gunung, turun gunung, dan akhirnya tibalah mereka di tempat itu. setelah tiba, lalu beberapa saat mereka beristirahat, dan sesudah itu mulailah mereka mandi serta ber-iimau seperti yang diniatkan semula. ketika mandi, mereka kedinginan sehingga badannya gemetar rasanya. setelah itu, mereka berdoa serta bernazar di tempat itu. dari hari ke hari, dari bulan ke bulan, akhirnya apa yang diminta kiranya telah terkabul. istri raja telah mengandung, dan tidak lama kemudian ia melahirkan seorang anak yang kulitnya putih bagaikan kapas.","sawise krungu omongan bojone kuwi, banjur esuke, karo nyiapke perlengkapan sing cukup, mangkatlah raja bebarengan karo bojone menyang panggonan kuwi. panggonan sing dituju kuwi pancen adoh banget, ngliwati alas alas, munggah gunung, mudhun gunung, lan pungkasane tekan panggonan kuwi. sawise tekan, banjur sawatara wektu padha ngaso, lan sawise kuwi wiwit padha adus lan adus kaya sing diniatke saka wiwitan. nalika adus, padha kedinginan nganti awake gemeter rasane. sawise kuwi, padha ndonga lan nadzar ing panggonan kuwi. saka dina menyang dina, saka sasi menyang sasi, pungkasane apa sing dijaluk kayata wis kabul. bojone raja wis ngandhut, lan ora suwe banjur nglairke sawijining anak sing kulite putih kaya kapas."
Mentiko Betuah,Aceh,6,"raja sangat gembira dan hatinya sangat senang. ia menyuruh memukul beduk untuk memberi tahu seluruh rakyat agar berkumpul di pendopo istananya. ketika seluruh rakyat telah berkumpul, lalu mereka bertanya kepada raja, apakah kiranya baginda memanggil kami kemari","raja banget bungah lan atine seneng banget. dheweke dhawuh nggebug bedhug kanggo ngabari kabeh rakyat supaya padha kumpul ing pendhapa kraton. nalika kabeh rakyat wis padha kumpul, banjur padha takon marang raja, apa kira-kira baginda ngundang awake dhewe menyang kene"
Mentiko Betuah,Aceh,7,"lalu raja menjawab, hai rakyatku, aku memanggil kalian kemari adalah hendak mengabarkan bahwa tuhan telah memberikan aku seorang putra.","banjur raja njawab, he rakyatku, aku ngundang kowe menyang kene arep ngabari yen gusti wis maringi aku sawijining putra."
Mentiko Betuah,Aceh,8,"mendengar ucapan raja, maka seluruh rakyat dengan serentak mengucapkan, alhamdulillah, tanda mereka turut bergembira pula. selanjutnya, raja menyampaikan bahwa ia hendak mengadakan kenduri atau selamatan sebagai tanda syukur atas rahmat tuhan yang telah melimpahinya itu. seluruh rakyat bersiap dan bekerja melaksanakan hajat raja itu. segala keperluan mereka sediakan; ada yang mencari kayu, ada yang memasang tungku, dan ada yang menyembelih kerbau sehingga segala sesuatu yang dibutuhkan telah tersedia sebagaimana mestinya. mereka menyembelih tujuh ekor kerbau, dan upacara selamatan itu berlangsung tujuh hari tujuh malam lamanya.","krungu omongane raja, banjur kabeh rakyat bebarengan ngucap, alhamdulillah, tandha padha melu bungah uga. sabanjure, raja nyampekke yen dheweke arep ngadani kenduri utawa slametan minangka tandha syukur marang rahmate gusti sing wis maringi kuwi. kabeh rakyat padha nyiapke lan nyambut gawe nindakke hajate raja kuwi. kebutuhan kabeh disedhiyakke; ana sing golek kayu, ana sing masang pawonan, lan ana sing nyembelih kebo nganti kabeh sing dibutuhke wis kasedhiya kaya mesthine. padha nyembelih pitu ekor kebo, lan upacara slametan kuwi lumaku pitung dina pitung bengi suwene."
Mentiko Betuah,Aceh,9,"lama-kelamaan, anak raja pun bertambah besar. pada umur enam tahun, dia disekolahkan. dia termasuk anak yang sangat cerdas; apa saja pelajaran yang diajarkan gurunya dengan mudah dapat dipelajarinya sehingga ia tamat dari sekolah itu. kemudian sekolahnya dilanjutkan ke sebuah kota yang penuh dengan keramaian. sebelum ia berangkat, segala sesuatu keperluannya dipersiapkan. ia diberikan uang untuk biaya secukupnya. maklumlah, ia adalah seorang anak raja kaya. apa yang diingini semuanya telah tersedia. ia adalah satu-satunya anak tunggal raja. lagi pula, ia sangat dimanjakan.","suwe-suwe, anake raja kuwi saya gedhe. nalika umur nem taun, dheweke disekolahke. dheweke kalebu anak sing banget pinter; apa wae pelajaran sing diwulangke gurune gampang bisa diapal lan dipelajari nganti lulus saka sekolah kuwi. banjur sekolahe diterusake menyang sawijining kutha sing rame banget. sakwise arep mangkat, kabeh kebutuhane disiapke. dheweke diparingi dhuwit kanggo biaya sing cukup. maklum, dheweke anake raja sugih. apa wae sing dikarepake kabeh wis ana. dheweke iku siji-sijine anak tunggal raja. apamaneh, dheweke banget dimanja."
Mentiko Betuah,Aceh,10,"tatkala ia berada di kota besar, dalam menempuh perjalanannya itu, dia rupanya terpengaruh oleh gadis-gadis kota sehingga pelajarannya berakhir dengan kegagalan. ini sangat merisaukan. telah bertahun-tahun ia dibiayai oleh orang tuanya untuk bersekolah sebagai tumpuan harapan orang tuanya kepadanya. namun kiranya semua itu berlangsung sia-sia. uang telah banyak habis, tetapi sekolahnya ternyata gagal. pulanglah ia ke kampung. orang tuanya amat marah kepadanya. rasanya hendak mengenyahkan anaknya itu dari permukaan bumi. harapan dan cita-citanya telah tenggelam ke dalam kerisauan yang sangat menyedihkan hatinya itu.","nalika dheweke ana ing kutha gedhe, sakwise nempuh lelampahan kuwi, jebul dheweke kepengaruh karo cah wadon kutha nganti pelajarane kandhas. kuwi banget ngelarani ati. wis pirang-pirang taun dheweke dibiayai karo wong tuwane kanggo sekolah dadi pangarep-arep wong tuwane marang dheweke. nanging jebul kabeh kuwi mung sia-sia. dhuwit wis akeh entek, nanging sekolahe jebul gagal. mbaliklah dheweke menyang desa. wong tuwane banget nesu marang dheweke. rasane kaya arep nyingkirake anak kuwi saka ndhuwur bumi. pangarep-arep lan cita-citane wis keleleb ing kahanan sing banget nglarani atine kuwi."
Mentiko Betuah,Aceh,11,"demikianlah keluhan sang raja ketika mengetahui kelakuan anaknya itu. selama di kampung, anak itu tidak mempunyai pekerjaan. maka, pada suatu hari, dia menemui ibunya. kepada ibunya, ia berkata bahwa ia ingin berdagang. dimintanya agar diberikan modal. permintaan anaknya itu lalu disampaikan kepada ayahnya sambil berkata, daripada dia kita hardik setiap hari, lebih baik kita berikan dia modal untuk berdagang.","mangkono keluhane sang raja nalika ngerti tingkah lakune anake kuwi. sakwise ana ing desa, anak kuwi ora nduweni pagawean. mula, ing sawijining dina, dheweke nemoni ibune. marang ibune, dheweke ngomong yen dheweke kepengin dagang. dijalukake supaya diparingi modal. panjaluk anake kuwi banjur disampekke marang bapake karo ngomong, tinimbang saben dina kita misuhi dheweke, luwih becik kita paringi dheweke modal kanggo dagang."
Mentiko Betuah,Aceh,12,"mendengar saran dan anjuran istrinya, maka raja menyediakan modal untuk berdagang kepada anaknya itu. ketika uang modal itu diserahkan kepadanya, raja berpesan, kalau engkau ingin berdagang, maka betul-betullah berdagang dan bekerjalah dengan sungguh-sungguh. tetapi, ingatlah bahwa jika uang yang kuberikan ini bila kau pulang ternyata telah habis, akan kupancung batang lehermu itu.","krungu saran lan anjuran bojone, banjur raja nyiapake modal dagang marang anake kuwi. nalika dhuwit modal kuwi diserahke marang dheweke, raja dhawuh, yen kowe kepengin dagang, mula tenanan dagang lan nyambut gawe kudu sregep. nanging, elinga yen dhuwit sing tak paringake iki nek kowe mulih jebul wis entek, bakal tak penggal gulu kowe kuwi."
Mentiko Betuah,Aceh,13,"anak itu pun berangkatlah setelah menyalami kedua orang tuanya. ketika itu, ibunya menangis karena harus berpisah dengan anak satu-satunya itu. anak itu berangkat dari satu kampung ke kampung yang lain. ia berjumpa dengan anak-anak kampung yang sedang menembak burung dengan ketapelnya. ia melarang mereka menganiaya burung karena burung itu tidak berdosa, katanya. tetapi, anak-anak kampung itu menjawab, apa yang kau tahu kutempeleng kepalamu nanti kalau kamu memberikan uang kepada kami, maka kami menghentikan perbuatan kami ini.","anak kuwi banjur mangkat sakwise salaman karo wong tuwane. nalika kuwi, ibune nangis merga kudu pisahan karo anak siji-sijine kuwi. anak kuwi lunga saka siji desa menyang desa liyane. dheweke ketemu karo bocah-bocah desa sing lagi nembaki manuk nganggo plintengane. dheweke ngelarang bocah-bocah kuwi nganiaya manuk merga manuk kuwi ora duwe dosa, kandane. nanging, bocah-bocah desa kuwi njawab, apa sing kok ngerti tak plintheng sirahmu mengko yen kowe menehi dhuwit marang awake dhewe, mula awake dhewe bakal mandheg nindakke tumindhak kuwi."
Mentiko Betuah,Aceh,14,"kemudian anak raja ini menyerahkan uang kepada anak-anak itu, masing-masing lima puluh ribu rupiah. perjalanan dilanjutkan sehingga sampailah ia di sebuah kampung lain. di sana, ia melihat segerombolan orang sedang menembak seekor ular yang besar. orang-orang itu ditegurnya, mengapa kalian membunuh ular itu lalu orang itu menjawab, kau jangan banyak bicara di sini, nanti akan kami tombak seperti ular ini.","banjur anak raja kuwi nyerahake dhuwit marang bocah-bocah kuwi, saben wong seket ewu rupiah. lelampahan diterusake nganti tekan sawijining desa liyane. ing kono, dheweke ndelok sekumpulan wong lagi nembaki ula gedhe. wong-wong kuwi dielingake, ngapa kowe padha mateni ula kuwi banjur wong-wong kuwi njawab, kowe aja akeh omong ing kene, mengko tak tombak kaya ula iki."
Mentiko Betuah,Aceh,15,"akhirnya, ia mengatakan kepada orang itu, inilah uang sedikit, janganlah kalian memperlakukan ular itu. kepada mereka, diberikannya lagi uangnya itu. demikianlah, selama dalam perjalanan itu, di mana saja ia menemui orang yang sedang menganiaya binatang liar, ia memberikan uang agar mereka menghentikan perbuatannya itu. sehingga akhirnya, habislah uangnya itu. ia melihat kantong tempat penyimpanan uang telah kosong. lalu ia mengeluh dan berpikir, bagaimana nanti aku pulang ke rumah tentu nanti aku akan dibacok karena uang yang diberikan ayahnya untuk modal berdagang telah habis dibagi-bagikan pada orang.","akhire, dheweke ngomong marang wong-wong kuwi, iki ana dhuwit sithik, aja padha nganiaya ula kuwi. marang wong-wong kuwi, dhuwite diparingake maneh. mangkono kuwi, sajroning lelampahan kuwi, nang endi wae dheweke nemokake wong sing nganiaya kewan alas, dheweke menehi dhuwit supaya padha mandheg nglakoni tumindak kuwi. mula pungkasane, enteklah dhuwite kuwi. dheweke ndelok kantong panyimpen dhuwite wis kosong. banjur dheweke ngeluh lan mikir, piye mengko aku mulih menyang omah mesthi mengko aku bakal dipateni merga dhuwit sing diwenehake bapake kanggo modal dagang wis entek dibagi-bagi marang wong."
Mentiko Betuah,Aceh,16,"ketika sedang termenung memikirkan nasibnya itu, terlihatlah olehnya sebatang pohon kayu yang sangat besar, dan di bawah pohon kayu itu terdapat batu besar. lalu ia duduk di atas batu itu sambil menangis tersedu-sedu. pada saat itu, tiba-tiba ada seekor ular besar, kira-kira sebesar pohon kelapa besar badannya. ular itu berkata, hai anak muda, mengapa engkau menangis","nalika isih lagi mikir nasibe kuwi, dheweke ndelok sawijining wit kayu sing gedhe banget, lan ing sangisoring wit kayu kuwi ana watu gedhe. banjur dheweke lungguh ing watu kuwi karo nangis. ing wektu kuwi, dumadakan ana sawijining ula gedhe, kira-kira sakgedhene wit klapa gedhe awake. ula kuwi ngomong, he cah nom, ngapa kowe nangis"
Mentiko Betuah,Aceh,17,"melihat ular itu, ia ketakutan dan hendak lari dari tempat itu jika ular itu tidak berkata lagi, jangan takut dan jangan lari. saya ini sudah tua. janganlah menangis lagi.","ndelok ula kuwi, dheweke wedi lan arep mlayu saka panggonan kuwi yen ora diucapake maneh karo ula kuwi, aja wedi lan aja mlayu. aku iki wis tuwa. aja nangis maneh."
Mentiko Betuah,Aceh,18,"dia diam mendengar ucapan ular itu. lalu ular itu meneruskan ucapannya, engkau telah menyelamatkan kami dari penganiayaan kaummu, bangsa manusia. nah, sekarang aku akan memberikan hadiah kepadamu. di dalam mulutku ini ada mentiko betuah, ambillah untukmu.","dheweke meneng krungu tembung ula kuwi. banjur ula kuwi neruske omongane, kowe wis nyelametkake aku saka panindhesane bangsamu, bangsa manungsa. nah, saiki aku bakal menehi hadiah marang kowe. ing njero lambeku iki ana mentiko betuah, jupuk wae kanggo kowe."
Mentiko Betuah,Aceh,19,"anak raja tadi berpikir, bagaimana ia akan mengambil benda itu dari mulut ular tersebut ia sangat takut barang kali akan ditelannya nanti. ia termangu-mangu dan tidak berani mendekati ular itu. kemudian ular berkata lagi, ambil saja, dan tidak apa-apa. akhirnya, dengan memberanikan diri, dia mengambil mentiko betuah dari mulut ular tersebut.","anak raja mau mikir, piye carane bakal njupuk barang kuwi saka cangkeme ula kuwi dheweke kuwatir banget manawa bakal ditelen mengko. dheweke meneng-meneng lan ora wani nyedhaki ula kuwi. banjur ula mau ngomong maneh, jupuk wae, lan ora apa-apa. akhire, kanthi negesi ati, dheweke njupuk mentiko betuah saka cangkeme ula kuwi."
Mentiko Betuah,Aceh,20,"ketika itu, ular berpesan padanya, apa yang kau ingini dengan mentiko betuah ini bisa kau dapatkan, tetapi dengan satu syarat, yaitu setiap malam jumat ia harus diasapi dengan kemeyan.","nalika kuwi, ula pesen marang dheweke, apa sing kowe karep karo mentiko betuah iki isa kowe entuk, nanging nganggo siji syarat, yaiku saben malam jumat kudu diasapi nganggo kemeyan."
Mentiko Betuah,Aceh,21,"anak muda itu sangat berbesar hati atas hadiah tersebut. lalu ia mencoba untuk menguji kebenaran ucapan ular tadi. sambil memejamkan matanya, ia berkata, hai mentiko betuah, berikan saya sepiring nasi dan gulai ayam, ikan goreng, serta makanan yang lezat lainnya. ketika membuka matanya, memang apa yang dimintanya itu telah tersedia di depannya. sesudah itu, ia pun pulanglah ke rumahnya. perjalanan pulang ke rumah itu ditempuhnya tujuh hari tujuh malam. ketika ia sampai, baju yang dipakainya dahulu sudah compang-camping.","anak enom kuwi bungah banget awit hadiah mau. banjur dheweke nyoba kanggo nguji benere omongan ula kuwi. sambil merem, dheweke ngomong, he mentiko betuah, wenehana aku sak piring sega lan gule pitik, iwak goreng, lan panganan sing enak liyane. nalika mbukak mripate, tenan barang sing dijaluk kuwi wis ana ing ngarepe. sawise kuwi, dheweke banjur mulih menyang omahe. lelaku mulih menyang omah kuwi ditempuh pitung dina pitung bengi. nalika tekan, klambi sing biyen dienggo wis jembrot."
Mentiko Betuah,Aceh,22,"ayahnya tercengang melihat keadaan anaknya itu sambil berkata, apakah yang telah engkau peroleh dalam perdagangan itu, anakku","bapake kaget ndelok kahanane anake kuwi sambil ngomong, apa sing wis kowe oleh ing dagangan kuwi, nak"
Mentiko Betuah,Aceh,23,"anaknya menjawab, tidak ada apa-apa, ayah.","anake njawab, ora ana apa-apa, pak."
Mentiko Betuah,Aceh,24,"ayahnya bertanya lagi, ke manakah uang yang kuberikan dahulu","bapake takon maneh, marang endi dhuwit sing tak wenehake mbiyen"
Mentiko Betuah,Aceh,25,"sudah habis, ayah, jawab anak itu.","wis entek, pak, jawab anak kuwi."
Mentiko Betuah,Aceh,26,apa yang kau buat dengan uang itu sehingga ia habis,apa sing kowe lakoni nganggo dhuwit kuwi nganti entek
Mentiko Betuah,Aceh,27,"setelah beberapa saat, meskipun merasa berat, pertanyaan ayah itu lalu dijawabnya, dalam perjalanan yang saya tempuh, saya bertemu dengan orang-orang yang menganiaya binatang. ada yang menganiaya burung, ular, monyet, dan lain-lain. kepada mereka, saya berikan uang agar mereka menghentikan perbuatannya itu sehingga uang yang ayah berikan dahulu telah habis semuanya.","sawise sawetara wektu, sanajan abot atine, pitakonane bapake banjur dijawab, ing lelampahan sing tak lakoni, aku ketemu karo wong-wong sing nganiaya kewan. ana sing nganiaya manuk, ula, kethek, lan liya-liyane. marang wong-wong kuwi, aku wenehi dhuwit supaya mandheg tumindake kuwi nganti dhuwit sing bapak wenehake wis entek kabeh."
Mentiko Betuah,Aceh,28,"raja marah ketika mendengar jawaban anaknya itu, lalu mengancam akan membacok kepalanya. dalam pada itu, anaknya berkata lagi, ayah, jangan marah-marah. uang yang ayah berikan itu akan kukembalikan dengan segera.","raja nesu nalika krungu jawaban anake kuwi, banjur ngancam arep mbacok sirahe. ing nalika kuwi, anake ngomong maneh, pak, aja nesu-nesu. dhuwit sing bapak wenehake kuwi bakal tak balekake enggal."
Mentiko Betuah,Aceh,29,"anak itu lalu memejamkan matanya sambil memegang mentiko betuah di tangannya. setelah sejenak kemudian ia membuka matanya, uang ayah itu telah berada di depannya. ia mengatakan, inilah ganti uang ayah tempo hari.","anak kuwi banjur merem sambil nyekel mentiko betuah ing tangane. sawise sawatara wektu banjur mbukak mripate, dhuwit bapake wis ana ing ngarepe. dheweke ngomong, iki gantine dhuwit bapak wingi."
Mentiko Betuah,Aceh,30,"ayahnya terkejut melihat keanehan itu serta mengubah sikap marahnya. ia gembira dan sangat senang kepada anaknya sehingga kejengkelannya itu lenyap. pada suatu ketika, anak itu memikirkan cara penyimpanan mentiko betuah itu. pada suatu hari, pergilah ia ke tukang emas. ia bermaksud agar mentiko betuah itu dibuat dalam bentuk cincin. tukang emas itu menanyakan mengenai mentiko betuah itu kepadanya. karena kebodohannya, lalu ia menceritakan segala sesuatu tentang mentiko betuah itu kepada tukang emas tersebut.","bapake kaget ndelok kahanan kuwi lan ngowahi sikap nesune. dheweke bungah lan seneng banget marang anake nganti nesune kuwi ilang. ing sawijining wektu, anak kuwi mikir carane nyimpen mentiko betuah kuwi. ing sawijining dina, banjur dheweke lunga menyang tukang emas. dheweke nduwe karep supaya mentiko betuah kuwi digawe dadi cicin. tukang emas kuwi takon ngenani mentiko betuah kuwi marang dheweke. awit kabodhoane, banjur kabeh diceritakake ngenani mentiko betuah kuwi marang tukang emas mau."
Mentiko Betuah,Aceh,31,"kemudian tahulah tukang emas itu tentang khasiat yang dikandung mentiko betuah itu. lalu kepada anak itu dikatakan bahwa pembuatan cincin itu tidak selesai dalam satu hari. karena itu, ia diminta untuk kembali mengambilnya besok. setelah itu, si anak itu pulanglah. setelah anak itu pulang, maka tukang emas itu mencoba seperti yang diterangkan anak tadi. lalu dimintanya emas sebesar tinju, maka dalam seketika itu pula emas itu berada di depannya. melihat kenyataan itu, maka timbullah keinginannya hendak melarikan barang anak raja itu.","banjur ngerti tukang emas kuwi babagan khasiat sing ana ing mentiko betuah kuwi. banjur marang anak kuwi diomongake yen gawean cicin kuwi ora rampung sak dina. awit saka kuwi, dijaluk supaya bali njupuke sesuk. sawise kuwi, anak kuwi banjur mulih. sawise anak kuwi mulih, banjur tukang emas kuwi nyoba kaya sing diterangake anak mau. banjur dijaluke emas sak gedhe bucu, banjur sak cepete emas kuwi ana ing ngarepe. ndelok kaanan kuwi, banjur muncul kekarepane arep nggawa mlayu barange anak raja kuwi."
Mentiko Betuah,Aceh,32,"keesokan harinya, pergilah anak itu ke toko emas hendak mengambil barangnya. dilihatnya toko emas tersebut telah tertutup. lalu ia bertanya kepada orang sebelah toko itu. kemudian orang itu mengatakan bahwa pemilik toko emas itu telah pulang ke kampungnya. lalu hatinya sangat kecewa dan mengutuk tukang emas yang telah menipunya itu. kepada ayah dan bundanya, ia menceritakan segala yang terjadi dengan mentiko betuah itu. akhirnya, karena kekesalan dan kekecewaannya, lalu ia duduk dan menangis.","esuke, anak kuwi lunga menyang toko emas arep njupuk barange. dideloke toko emas kuwi wis ketutup. banjur dheweke takon marang wong sak toko kuwi. banjur wong kuwi ngomong yen sing nduwe toko emas kuwi wis mulih menyang kampunge. banjur atine kuciwa banget lan nggetuni tukang emas sing wis nipu kuwi. marang bapak lan ibune, kabeh diceritakake ngenani sing kedadeyan karo mentiko betuah kuwi. akhire, awit kuciwa lan kekuciwaane, banjur dheweke lungguh lan nangis."
Mentiko Betuah,Aceh,33,"sehabis itu, ia keluar dari rumahnya dalam keadaan termenung-menung dan termangu. pikirannya selalu tertuju pada bagaimana memperoleh kembali mentiko betuah yang telah dilarikan orang itu. ketika itu, datanglah seekor tikus lalu menanyakan mengapa ia kelihatan bermurung saja. anak raja itu menjawab dan menceritakan segala yang telah menimpa dirinya. setelah mengetahui hal itu, maka tikus mencari kucing. lalu kepadanya diceritakan nasib yang telah menimpa anak raja itu. kemudian kucing mencari anjing lalu menceritakan pula kepadanya.","sawise kuwi, dheweke metu saka omahe ing kaanan ngelamun lan melung-melung. pikirane tansah kepikiran piye carane entuk mentiko betuah maneh sing wis digawa mlayu wong kuwi. nalika kuwi, teka kewan tikus banjur takon kenapa dheweke katon melas terus. anak raja kuwi njawab lan nyritakake kabeh sing wis menimpa dhirine. sawise ngerti kuwi, banjur tikus kuwi golek kucing. banjur marang kucing diceritakake nasib sing wis menimpa anak raja kuwi. banjur kucing golek asu banjur diceritakake maneh marang asu kuwi."
Mentiko Betuah,Aceh,34,"akhirnya, tikus, kucing, dan anjing bermufakat untuk menolong anak raja itu. pada hari itu juga, ketiga ekor binatang itu mencari jejak orang yang melarikan mentiko betuah. mereka mencium jejak ke sana ke mari, lalu akhirnya menemukannya. rupanya, orang itu menyeberangi sungai. tikus dan kucing tak mampu mengikuti jejak itu. kini anjinglah yang mampu berenang, sedangkan tikus dan kucing menunggangi anjing sehingga ketiga binatang itu tiba di seberang. setiba di seberang, mereka terus mencari jejak. rupanya orang itu mempunyai rumah di kampung itu.","banjur, tikus, kucing, lan asu rembugan kanggo nulungi anak raja kuwi. ing dina kuwi uga, telung kewan kuwi golek tilas wong sing nggawa mentiko betuah. wong kuwi nyabrang kali. tikus lan kucing ora bisa ngoyak tilas kuwi. saiki asu sing bisa nglangi, dene tikus lan kucing numpak asu nganti tekan sebrang. sawise tekan sebrang, terus golek tilas. katone, wong kuwi nduweni omah ing kampung kono."
Mentiko Betuah,Aceh,35,"ketiga binatang ini lalu berunding untuk mencari akal bagaimana cara mengambil kembali mentiko betuah itu. lalu mereka mengatur tugas masing-masing. si tikus masuk ke dalam lemari, kucing duduk di rumah, dan anjing mengawasi sekitar rumah. lalu mereka mulai menjalankan tugasnya. tetapi, barang yang dicari itu tak kunjung ditemukan juga. akhirnya, mereka mengetahui bahwa mentiko betuah telah disimpan dalam mulut orang itu. kemudian mereka mencari jalan lain untuk mengeluarkan mentiko betuah dari mulut orang itu. caranya adalah tikus duduk di atas mulut orang itu, sedangkan ekornya dimasukkan ke dalam hidung orang itu hingga orang itu bersin. bila ia bersin, maka benda itu akan terlontar dari mulutnya, lalu kucing menangkap benda itu dan melarikannya ke bawah rumah. demikianlah rencana mereka.","telung kewan kuwi banjur rembugan kanggo golek akal piye carane njupuk mentiko betuah kuwi maneh. banjur padha ngatur tugase dhewe-dhewe. tikus mlebu lemari, kucing lungguh ing omah, lan asu ngawasi sakupeng omah. banjur padha miwiti tugase. nanging, barang sing digoleki kuwi durung tinemu. akhire, padha ngerti yen mentiko betuah disimpen ing cangkeme wong kuwi. banjur padha golek cara liya kanggo njupuk mentiko betuah saka cangkeme wong kuwi. carane yaiku tikus lungguh ing ndhuwure cangkeme wong kuwi, dene buntute dilebokake ing irunge wong kuwi nganti wong kuwi kesrek. yen kesrek, banjur barang kuwi bakal keceluk saka cangkeme, banjur kucing nyekel barang kuwi lan nggawa mlayu menyang ngisor omah. kaya mangkono rencanane."
