judul,provinsi,id_teks,teks,referensi
Puteri Niweri Gading,Aceh,1,"alkisah dahulu, di negeri alas, yang termasuk wilayah nanggro aceh darussalam, ada seorang raja yang bijaksana dan dicintai rakyatnya. ia memerintah dengan adil dan bijaksana. sehari-hari pikirannya dicurahkan untuk memajukan negeri dan kemakmuran rakyatnya. namun sayang, sang raja tidak mempunyai putera. mereka sedih. atas nasihat orang pintar, raja dan permaisuri kemudian tekun berdoa sambil berpuasa. beberapa bulan kemudian, permaisuri mengandung. setelah sampai waktunya, permaisuri melahirkan anak laki-laki yang diberi nama amat mude.","alkisah mbiyen, neng nagara alas, sing kalebu wewengkon nanggro aceh darussalam, ana sawijining raja sing wicaksana lan disenengi rakyate. dheweke mrentah kanthi adil lan wicaksana. saben dina pikirane dicurhake kanggo majukake nagara lan kamakmuran rakyate. nanging sayange, sang raja ora nduweni putra. wong-wong padha sedhih. miturut nasehate wong pinter, raja lan permaisuri banjur sregep ndedonga bareng pasa. sawise sawetara sasi, permaisuri ngandhut. sawise tekan waktune, permaisuri ngelairake anak lanang sing dijenengke amat mude."
Puteri Niweri Gading,Aceh,2,"belum genap setahun umur amat mude, ayahnya meninggal dunia. karena amat mude masih bayi, maka adik sang raja, atau paman (pakcik) amat mude, diangkat menjadi raja sementara. pakcik itu bernama raja muda. setelah diangkat menjadi raja, ia malah bertindak kejam kepada amat mude dan ibunya. mereka diasingkan ke sebuah hutan terpencil. raja muda ingin menguasai sepenuhnya kerajaan yang sesungguhnya menjadi hak amat mude. walau dibuang jauh dari istana, permaisuri tidak mengeluh. ia terima cobaan berat itu dengan sabar dan tabah. ia besarkan amat mude dengan penuh kasih sayang. tahun demi tahun berlalu, tak terasa, amat mude tumbuh menjadi anak yang cerdas dan tampan. amat mude suka memancing ikan di sungai.","durung nganti setaun umure amat mude, bapake seda. amarga amat mude isih bayi, mula adhine sang raja, utawa paklik (pakcik) amat mude, diangkat dadi raja samentara. pakcik kuwi jenenge raja muda. sawise diangkat dadi raja, dheweke malah tumindak kejem marang amat mude lan ibune. wong loro kuwi diusir menyang alas sing adoh. raja muda kepengin nguwasani sakabehe kraton sing sakjane dadi hake amat mude. senajan dibuwang adoh saka kraton, permaisuri ora sambat. dheweke nrima cobaan abot kuwi kanthi sabar lan tabah. dheweke nggedheke amat mude kanthi penuh katresnan. taun demi taun liwati, ora kroso, amat mude saya gedhe dadi bocah sing cerdas lan ayu. amat mude seneng mancing iwak neng kali."
Puteri Niweri Gading,Aceh,3,"pada suatu hari, permaisuri dan amat mude pergi ke sebuah desa di pinggir hutan untuk menjual ikan. tanpa disangka, ia bertemu dengan saudagar kaya. ternyata, ia bekas sahabat suaminya dulu. mengapa tuan putri dan putra mahkota berada di tempat ini tanya saudagar itu keheranan. permaisuri menceritakan semua kejadian yang telah menimpanya. mendengar hal itu, sang saudagar segera mengajak mereka ke rumahnya dan membeli semua ikannya. setibanya di rumah saudagar itu, ia menyuruh istrinya segera memasak ikan tersebut. ketika sedang memotong perut ikan, sang istri merasa heran karena dari perut ikan itu keluar telur ikan yang berupa emas murni. kemudian, butiran emas tersebut dijual ke pasar oleh istri saudagar. uangnya ia gunakan untuk membangun rumah permaisuri dan putranya. sejak saat itu, permaisuri dan amat mude telah berubah menjadi orang kaya berkat telur-telur emas dari ikan.","ing sawijining dina, permaisuri lan amat mude lunga menyang desa ing pinggir alas kanggo dodolan iwak. ora dikira, dheweke ketemu karo saudagar sugih. ternyata, dheweke kuwi mantan kancane bojone mbiyen. ngapa tuan putri lan putra mahkota ana neng panggonan kene pitakone saudagar kuwi kaget. permaisuri nyritakake kabeh kedadean sing wis dialami. krungu kuwi, saudagar mau langsung ngajak wong loro kuwi menyang omahe lan tuku kabeh iwake. tekane neng omah saudagar kuwi, dheweke nyuruh bojone supaya langsung masak iwak mau. nalika lagi motong weteng iwak, bojone kaget amarga saka weteng iwak kuwi metu endhog iwak sing awujud emas murni. banjur, butiran emas mau didol neng pasar karo bojone saudagar. duite digunakake kanggo mbangun omahe permaisuri lan anake. wiwit wektu kuwi, permaisuri lan amat mude wis malih dadi wong sugih marga endhog-endhog emas saka iwak."
Puteri Niweri Gading,Aceh,4,"cerita tentang kekayaan permaisuri dan putranya sampai ke telinga raja muda. pada suatu hari, raja muda memanggil amat mude ke istana. ia memerintahkan amat mude memetik kelapa gading untuk mengobati penyakit istri raja muda di sebuah pulau yang terletak di tengah laut. konon, lautan di sekitar pulau itu dihuni oleh binatang-binatang buas. siapa pun yang melewati lautan itu pasti celaka. raja muda mengancam amat mude bahwa jika tidak berhasil, ia akan dihukum mati. tapi amat mude tak peduli dengan ancaman itu. niatnya tulus hendak menolong istri raja muda. ia pun segera berangkat meninggalkan istana.","crita bab kasugihane permaisuri lan anake nganti tekan kupinge raja muda. ing sawijining dina, raja muda ngundang amat mude menyang kraton. dheweke marentahke amat mude supaya njupuk klapa gading kanggo ngobati larane bojone raja muda neng sawijining pulo sing ana ing tengah segara. jare, segara ing sakupenge pulo kuwi dienggoni kewan-kewan galak. sapa wae sing liwat segara kuwi mesthi cilaka. raja muda ngancam amat mude yen ora kasil, bakal dihukum pati. nanging amat mude ora peduli karo ancaman kuwi. niatane tulus arep nulungi bojone raja muda. dheweke langsung mangkat ninggalake kraton."
Puteri Niweri Gading,Aceh,5,"setibanya di pantai, ia duduk termenung. tiba-tiba muncul di hadapannya seekor ikan besar bernama silenggang raye, didampingi oleh raja buaya dan seekor naga besar. singkat cerita, amat mude telah menemukan pohon kelapa gading dengan bantuan silenggang raye, raja buaya, dan seekor naga. selanjutnya, amat mude memanjat pohon. ketika sedang memetik buah kelapa gading, tiba-tiba terdengar suara seorang perempuan. siapa pun yang berhasil memetik buah kelapa gading, dia akan menjadi suamiku.","tekane neng pantai, dheweke lungguh meneng. dumadakan muncul neng ngarepe sawijining iwak gedhe jenenge silenggang raye, dikancani raja baya lan naga gedhe. cekak crita, amat mude wis nemu wit klapa gading nganggo pitulungane silenggang raye, raja baya, lan naga. sabanjure, amat mude munggah wit. nalika lagi njupuk woh klapa gading, dumadakan krungu swara wadon. sapa wae sing bisa njupuk woh klapa gading, dheweke bakal dadi bojoku."
Puteri Niweri Gading,Aceh,6,siapakah engkau tanya amat mude.,sapa kowe pitakone amat mude.
Puteri Niweri Gading,Aceh,7,"aku putri niwer gading, jawab suara dari bawah pohon kelapa.","aku putri niwer gading, wangsulan swara saka ngisor wit klapa."
Puteri Niweri Gading,Aceh,8,"amat mude cepat-cepat memetik kelapa gading. setelah turun dari atas pohon kelapa, alangkah takjubnya amat mude melihat kecantikan putri niwer gading. akhirnya, amat mude pun mengajak sang putri pulang ke rumahnya untuk dipersunting.","amat mude cepet-cepet njupuk klapa gading. sawise mudhun saka dhuwur wit klapa, amat mude kaget ndeleng ayune putri niwer gading. akhire, amat mude ngajak sang putri bali menyang omahe kanggo dinikahkake."
Puteri Niweri Gading,Aceh,9,"setelah menikah, amat mude beserta istri dan ibunya berangkat ke istana untuk menyerahkan buah kelapa gading. kedatangan amat mude membuat raja muda terheran-heran. orang yang berhasil melewati rintangan di pulau angker pastilah orang sakti. ia tidak mau main-main lagi. kini tidak ada alasan untuk menghukum mati keponakannya itu. akhirnya, raja muda sadar akan kesalahannya. ia memohon maaf kepada permaisuri dan amat mude. beberapa hari kemudian, amat mude dinobatkan menjadi raja negeri alas.","sawise nikah, amat mude bareng bojone lan ibune mangkat menyang kraton kanggo masrahke woh klapa gading. tekane amat mude nggawe raja muda gumun. wong sing bisa ngliwati rintangan neng pulo angker mesthi wong sakti. dheweke ora wani main-main maneh. saiki ora ana alesan kanggo hukum pati ponakane kuwi. akhire, raja muda eling marang kesalahane. dheweke nyuwun ngapura marang permaisuri lan amat mude. sawise sawatara dina, amat mude dinobatake dadi raja nagara alas."
