judul,provinsi,id_teks,teks,referensi
Putri Kandita,Jawa Barat,1,"alkisah, di daerah pakwan, kini kota bogor, jawa barat, terdapat seorang raja bernama sri baduga maharaja atau prabu siliwangi yang bertahta di kerajaan pakuan pajajaran. ia adalah raja yang arif dan bijaksana. sang prabu juga mempunyai seorang permaisuri yang cantik jelita dan beberapa selir yang cantik-cantik. dari hasil perkawinannya dengan sang permaisuri, lahir seorang putri yang bernama putri kandita. putri kandita memiliki paras yang cantik melebihi kecantikan ibunya. ia merupakan putri kesayangan prabu siliwangi.","alkisah, ing daerah pakwan, saiki dadi kutha bogor, jawa barat, ana raja jenenge sri baduga maharaja utawa prabu siliwangi sing jumeneng neng karajaan pakuan pajajaran. dheweke kuwi raja sing wicaksana lan bijaksana. sang prabu uga nduweni permaisuri ayu banget lan sawetara selir sing uga ayu-ayu. saka pernikahane karo sang permaisuri, lair putri jenenge putri kandita. putri kandita nduweni rupa sing ayu ngungkuli ayune ibune. dheweke dadi putri kesayangane prabu siliwangi."
Putri Kandita,Jawa Barat,2,"ketika ia mulai dewasa, sifat arif dan bijaksana, seperti yang dimiliki oleh sang ayah, mulai muncul pada dirinya. tidak mengherankan jika prabu siliwangi bermaksud mencalonkan putri kandita sebagai penggantinya kelak. namun, rencana tersebut ternyata tidak disukai oleh para selir dan putra-putrinya yang lain. oleh karena itu, mereka pun bersekongkol untuk mengusir putri kandita dan ibunya dari istana.","nalika dheweke mulai diwasa, sifat arif lan wicaksana, kaya sing diduweni bapake, mulai metu ing awake. mula ora aneh yen prabu siliwangi nduweni niyat ngajokake putri kandita dadi penggantie. nanging, rencana kuwi ora disenengi dening para selir lan anak-anake sing liyane. mula saka kuwi, wong-wong kuwi kongkalikong arep ngusir putri kandita lan ibune saka istana."
Putri Kandita,Jawa Barat,3,"suatu malam, para selir prabu siliwangi dan putra-putri mereka mengadakan pertemuan rahasia di dalam istana.","wengi-wengi, para selire prabu siliwangi lan anak-anake ngadhakake rapat rahasia neng njero istana."
Putri Kandita,Jawa Barat,4,"bagaimana cara menyingkirkan putri kandita dan permaisuri dari istana ini tanpa sepengetahuan prabu tanya salah seorang selir. kita harus berhati-hati karena jika prabu mengetahui rencana ini, maka kita semua akan binasa, ujar selir yang lain.","“piye carane nyingkirke putri kandita lan permaisuri saka istana iki tanpa dingerteni prabu” pitakon salah sijine selir. “kita kudu ngati-ati, merga nek prabu ngerti rencana iki, ya bakal cilaka kabeh,” ujare selir sing liyane."
Putri Kandita,Jawa Barat,5,sejenak suasana pertemuan itu menjadi hening. semuanya sedang berpikir keras untuk mencari cara yang paling tepat agar rencana mereka dapat terlaksana tanpa sepengetahuan prabu siliwangi.,"sakcepete, suasana rapat kuwi dadi meneng. kabeh mikir keras golek cara sing paling pas supaya rencana kuwi bisa kelakon tanpa dingerteni prabu siliwangi."
Putri Kandita,Jawa Barat,6,"sekarang aku tahu caranya, sahut seorang selir yang lain memecah suasana keheningan. apakah caramu itu tanya semua peserta rapat serentak. aku mempunyai kenalan seorang dukun yang terkenal dengan kesaktian ilmu hitamnya. dukun itu pasti mau membantu kita jika kita memberinya upah yang besar, jawab selir itu. semua peserta rapat setuju dengan cara tersebut.","“saiki aku ngerti carane,” tembung selir siji malih, mecah suasana sepi kuwi. “apa caramu kuwi” pitakon kabeh peserta rapat bareng-bareng. “aku nduweni kenalan dukun sing kondhang ilmu irenge. dukun kuwi mesthi gelem nulungi nek dikeki upah gedhe,” wangsule selir kuwi. kabeh peserta rapat sarujuk karo cara kuwi."
Putri Kandita,Jawa Barat,7,"pada esok hari, para selir mengutus seorang dayang-dayang istana untuk menemui dukun itu di gubuknya di sebuah desa yang letaknya cukup jauh dari istana. setelah menjelaskan maksud kedatangannya, utusan itu kemudian menyerahkan sejumlah keping uang logam emas kepada sang dukun. tanpa berpikir panjang, sang dukun pun langsung menyanggupi permintaan para selir tersebut.","esuke, para selir ngutus dayang istana arep ketemu karo dukun kuwi neng gubuke neng desa adoh saka istana. sawise nerangke maksude, utusan kuwi nyerahke koin emas marang dukune. tanpa mikir dawa, dukun kuwi langsung gelem nampa panjaluk para selir kuwi."
Putri Kandita,Jawa Barat,8,"setelah utusan selir itu kembali ke istana, sang dukun segera melaksanakan tugasnya. dengan ilmu hitam yang dimiliki, dukun itu menyihir putri kandita dan ibunya dengan penyakit kusta, sehingga sekujur tubuh mereka yang semula mulus dan bersih, timbul luka borok dan mengeluarkan bau tidak sedap.","sawise utusan kuwi bali menyang istana, dukune langsung nindakake tugase. kanthi ilmu ireng, dukun kuwi nyepet putri kandita lan ibune nganggo penyakit kusta, nganti sak awake sing biyen alus lan resik, dadi loro, borokan, lan ambune ora enak."
Putri Kandita,Jawa Barat,9,"prabu siliwangi heran melihat penyakit borok itu tiba-tiba menyerang putri dan permaisurinya secara bersamaan. ia pun segera mengundang para tabib untuk mengobati penyakit tersebut. para tabib dari berbagai negeri sudah didatangkan, namun tak seorang pun yang mampu menyembuhkan penyakit putri kandita dan sang permaisuri. bahkan, penyakit sang permaisuri semakin hari semakin parah dan menyebarkan bau busuk yang sangat menyengat. tubuhnya pun semakin lemah karena tidak mau makan dan minum.","prabu siliwangi gumun ndelok penyakit borok kuwi jebul teka-teka nyerang putrine lan permaisurine bareng-bareng. dheweke langsung ngundang para tabib kanggo ngobati. tabib saka negara liya wis ditekakake, nanging ora ana siji wae sing bisa marekke. malah, permaisurie saben dina tambah parah lan ambune saya ngelunungi. awake saya ringkih amarga ora gelem mangan lan ngombe."
Putri Kandita,Jawa Barat,10,"selang beberapa hari kemudian, sang permaisuri menghembuskan nafas terakhirnya. kepergian sang permaisuri benar-benar meninggalkan luka yang sangat dalam bagi seluruh isi istana, khususnya prabu siliwangi. sejak itu, ia selalu duduk termenung seorang diri. satu-satunya harapan yang dapat mengobati kesedihannya adalah putri kandita. namun, harapan itu hanya tinggal harapan karena penyakit sang putri tak kunjung sembuh. keadaan itu pun tidak disiasiakan oleh para selir dan putra-putrinya. mereka bersepakat untuk menghasut prabu siliwangi agar segera mengusir putri kandita dari istana.","sawise sawetara dina, permaisuri nglemprah ambegan pungkasan. wusane permaisuri ninggalake lara abot kanggo istana, luwih-luwih prabu siliwangi. sakwise kuwi, dheweke tansah lingsem piyambakan. siji-sijine pangarep-arep kanggo ngobati sedhihe yaiku putri kandita. nanging, pangarep-arep kuwi malah muspra amarga penyakite sang putri ora mari-mari. kahanan kuwi dimanfaatke dening para selir lan anak-anake. wong-wong kuwi kompak ngojok-ojoki prabu siliwangi supaya ngusir putri kandita saka istana."
Putri Kandita,Jawa Barat,11,"ampun baginda prabu, izinkanlah hamba untuk menyampaikan sebuah saran kepada baginda, pinta seorang selir. apakah saranmu itu, wahai selirku katakanlah, jawab prabu siliwangi. begini, baginda. kita semua sudah tahu bahwa keadaan penyakit putri kandita saat ini semakin parah dan sulit untuk disembuhkan. jika sang putri dibiarkan terus tinggal di istana, hamba khawatir penyakitnya akan membawa malapetaka bagi negeri ini, hasud seorang selir.","“ampun baginda prabu, kersakna kula ngaturake saran kanggo baginda,” atur selir siji. “apa sarannmu kuwi, selirku kandhakna wae,” wangsule prabu siliwangi. “mangkene, baginda. kita kabeh wis ngerti nek kahanane penyakit putri kandita saya parah lan angel mari. yen putri tetep neng istana, kula wedi penyakite bakal nggawa balak kanggo nagari iki,” ujare selir kuwi."
Putri Kandita,Jawa Barat,12,"mulanya, prabu siliwangi merasa berat untuk menerima saran itu karena begitu sayangnya kepada putri kandita. namun, karena para selir terus mendesaknya, maka dengan berat hati ia terpaksa mengusir putri kandita dari istana.","awale, prabu siliwangi ora gelem nampa saran kuwi merga tresna banget karo putri kandita. nanging, merga terus dicekel para selir, prabu siliwangi kanti abot ati kepeksa ngusir putri kandita saka istana."
Putri Kandita,Jawa Barat,13,"dengan hati hancur, putri kandita pun meninggalkan istana melalui pintu belakang istana. ia berjalan menuruti ke mana kakinya melangkah, tanpa arah dan tujuan yang pasti. setelah berhari-hari berjalan, putri kandita tiba di pantai selatan. putri prabu siliwangi yang malang itu bingung harus berjalan ke mana lagi. di hadapannya terbentang samudera yang luas dan dalam. tidak mungkin pula ia kembali ke istana.","kanthi ati remuk, putri kandita ninggalake istana liwat lawang mburi. dheweke mlaku manut ngendi sikile mlaku, tanpa arah lan tujuan sing cetha. sawise dina-dina mlaku, putri kandita tekan pesisir kidul. putri prabu siliwangi kuwi bingung arep mlaku menyang endi. nang ngarepe ngentek segara jembar lan jeru. bali menyang istana ya ora mungkin."
Putri Kandita,Jawa Barat,14,"ah, aku letih sekali. lebih baik aku beristirahat dulu di sini, keluh putri kandita seraya merebahkan tubuhnya di atas sebuah batu karang. sang putri tampak begitu kelelahan sehingga dalam beberapa saat saja ia langsung tertidur.","“ah, aku kesel banget. mending aku ngaso dhisik neng kene,” ngeluh putri kandita karo nglemprah awake neng watu karang. sang putri katon kesel banget nganti sawatara wektu langsung turu."
Putri Kandita,Jawa Barat,15,"dalam tidurnya, ia mendengar sebuah suara yang menegurnya. wahai putri kandita, jika kamu ingin sembuh dari penyakitmu, berceburlah ke dalam lautan ini. niscaya kulitmu akan pulih seperti sediakala, ujar suara itu.","nalika turu, dheweke krungu swara nyapa. “wahai putri kandita, nek kowe pengin mari saka penyakitmu, ceburana awakmu neng segara iki. dijamin kulitmu bakal mari kaya biyen,” ujare swara kuwi."
Putri Kandita,Jawa Barat,16,"putri kandita pun cepat-cepat bangun setelah mendengar suara itu. apakah aku bermimpi gumamnya sambil mengusap-usap matanya tiga kali. setelah itu, sang putri mengamati sekelilingnya, namun tak seorang pun yang dilihatnya. aku mendengar suara itu dengan sangat jelas. tetapi kenapa tidak ada orang di sekitar sini wah, jangan-jangan ini wangsit, pikirnya.","putri kandita langsung tangi krungu swara kuwi. “apa aku ngimpi” gumame karo ngelus-elus mripat ping telu. sawise kuwi, putri ngelingi sakupenge, nanging ora ana siji wae wong. “aku krungu swara kuwi cetha banget. tapi kok ora ana wong nang kene aja-aja kuwi wangsit,” pikire."
Putri Kandita,Jawa Barat,17,"meyakini suara itu sebagai sebuah wangsit, putri kandita pun menceburkan diri ke laut. sungguh ajaib saat menyentuh air, seluruh tubuhnya yang dihinggapi penyakit kusta berangsur-angsur hilang hingga akhirnya kembali menjadi halus dan bersih seperti sediakala. tidak hanya itu, putri kesayangan prabu siliwangi itu juga menjadi putri yang sakti mandraguna.","yakin swara kuwi wangsit, putri kandita banjur nyebur menyang laut. ajaib nalika nyentuh banyu, sak awake sing kena penyakit kusta kuwi alon-alon mari nganti mulih alus lan resik kaya biyen. ora mung kuwi, putri kesayangane prabu siliwangi kuwi dadi putri sing sakti mandraguna."
Putri Kandita,Jawa Barat,18,"meskipun telah sembuh dari penyakitnya, putri kandita enggan untuk kembali ke istana. ia lebih memilih untuk menetap di pantai sebelah selatan wilayah pakuan pajajaran itu. sejak menetap di sana, ia dikenal luas di berbagai kerajaan yang ada di pulau jawa sebagai putri yang cantik dan sakti. para pangeran dari berbagai kerajaan pun berdatangan untuk melamarnya.","senajan wis mari saka penyakite, putri kandita ora gelem bali menyang istana. dheweke milih tetep manggon neng pesisir kidul wewengkon pakuan pajajaran. wiwit manggon nang kono, dheweke dikenal nganti nagara-nagara nang pulo jawa dadi putri sing ayu lan sakti. para pangeran saka nagara-nagara teka arep nglamar."
Putri Kandita,Jawa Barat,19,"menghadapi para pelamar tersebut, putri kandita mengajukan sebuah syarat, yaitu dirinya bersedia dipersunting asalkan mereka sanggup mengalahkan kesaktiannya, termasuk bertempur di atas gelombang laut yang ada di selatan pulau jawa. namun, jika kalah adu kesaktian itu, maka mereka harus menjadi pengikut putri kandita. dari sekian banyak pangeran yang beradu kesaktian dengan putri kandita, tak seorang pun dari mereka yang mampu mengalahkan kesaktian sang putri.","ngadhepi para pelamar kuwi, putri kandita ngajokake syarat, yaiku dheweke gelem dinikah nek para pangeran kuwi bisa ngalahke kesaktianne, kalebu perang nang dhuwur ombak laut kidul. yen kalah, kudu dadi kawulane putri kandita. saka akeh pangeran sing perang adu kasekten karo putri kandita, ora ana siji wae sing bisa ngalahke sang putri."
Putri Kandita,Jawa Barat,20,"dengan demikian, para pelamar tersebut akhirnya menjadi pengikut putri kandita. sejak itulah, putri kandita dikenal sebagai ratu penguasa laut selatan pulau jawa.","mula saka kuwi, para pelamar kuwi pungkasane dadi kawulane putri kandita. wiwit wektu kuwi, putri kandita dikenal dadi ratu pangwasane laut kidul pulo jawa."
